{
  "$schema": "../../../../schemas/source-entity-observation.schema.json",
  "schema_version": "0.1.0",
  "observation_id": "aon:feat.vanguard-ward:6806aa71241c43e9",
  "entity_type": "feat",
  "source": {
    "site_id": "aon",
    "url": "https://www.aonprd.com/FeatDisplay.aspx?ItemName=Vanguard+Ward",
    "license_url": "https://www.aonprd.com/Licenses.aspx",
    "declared_publisher": "Paizo",
    "first_party_status": "confirmed"
  },
  "retrieval": {
    "retrieved_at": "2026-09-12T20:42:57.201Z",
    "http_status": 200,
    "content_sha256": "6806aa71e0a5319ff4d21df0a8227189b767d19537e00f6242e35c2bfbff40df",
    "raw_artifact_path": "../../../raw/feats/batch/vanguard-ward/aon.html",
    "response_content_type": "text/html; charset=utf-8"
  },
  "parser": {
    "name": "aon-feat-batch-adapter",
    "version": "0.1.0",
    "parsed_at": "2026-09-13T04:49:31.349Z"
  },
  "page": {
    "title_raw": "Vanguard Ward - Feats - Archives of Nethys: Pathfinder RPG Database",
    "breadcrumbs_raw": [],
    "license_notice_raw": null,
    "source_notice_raw": "Armor Master's Handbook pg. 13"
  },
  "entity_raw": {
    "name_raw": "Vanguard Ward",
    "definition_type_raw": "Combat, Shield Style",
    "source_book_raw": "Armor Master's Handbook pg. 13",
    "definition_raw": "Source Armor Master's Handbook pg. 13\nYou strongly defend your allies.\n\nPrerequisites: BodyguardAPG, Combat Reflexes, Vanguard Style, proficiency with light or heavy shields.\n\nBenefit: While using Vanguard Style, when an adjacent ally is attacked or required to make a Reflex saving throw, you can expend a use of an attack of opportunity to use both Bodyguard and Vanguard Style to protect that ally. You can also lose your shield bonus to AC to grant your ally a shield bonus to AC of the same value for as long as that ally gains a bonus to Reflex saves from Vanguard Style.",
    "links_raw": [
      {
        "anchor_text_raw": "Armor Master's Handbook pg. 13",
        "href_raw": "http://paizo.com/products/btpy9jbh?Pathfinder-Player-Companion-Armor-Masters-Handbook\n",
        "href_resolved": "http://paizo.com/products/btpy9jbh?Pathfinder-Player-Companion-Armor-Masters-Handbook",
        "source_field": "/entity_raw/publications_raw",
        "context_raw": "Armor Master's Handbook pg. 13",
        "role_hint": "publication",
        "target_entity_type_hint": "publication",
        "target_entity_id_hint": null
      },
      {
        "anchor_text_raw": "BodyguardAPG",
        "href_raw": "FeatDisplay.aspx?ItemName=Bodyguard",
        "href_resolved": "https://www.aonprd.com/FeatDisplay.aspx?ItemName=Bodyguard",
        "source_field": "/entity_raw/prerequisites_raw",
        "context_raw": "BodyguardAPG, Combat Reflexes, Vanguard Style, proficiency with light or heavy shields.",
        "role_hint": "prerequisite",
        "target_entity_type_hint": "feat",
        "target_entity_id_hint": "feat.bodyguard"
      },
      {
        "anchor_text_raw": "Combat Reflexes",
        "href_raw": "FeatDisplay.aspx?ItemName=Combat Reflexes",
        "href_resolved": "https://www.aonprd.com/FeatDisplay.aspx?ItemName=Combat%20Reflexes",
        "source_field": "/entity_raw/prerequisites_raw",
        "context_raw": "BodyguardAPG, Combat Reflexes, Vanguard Style, proficiency with light or heavy shields.",
        "role_hint": "prerequisite",
        "target_entity_type_hint": "feat",
        "target_entity_id_hint": "feat.combat-reflexes"
      },
      {
        "anchor_text_raw": "Vanguard Style",
        "href_raw": "FeatDisplay.aspx?ItemName=Vanguard Style",
        "href_resolved": "https://www.aonprd.com/FeatDisplay.aspx?ItemName=Vanguard%20Style",
        "source_field": "/entity_raw/prerequisites_raw",
        "context_raw": "BodyguardAPG, Combat Reflexes, Vanguard Style, proficiency with light or heavy shields.",
        "role_hint": "prerequisite",
        "target_entity_type_hint": "feat",
        "target_entity_id_hint": "feat.vanguard-style"
      }
    ],
    "sections_raw": [
      {
        "heading_raw": "Prerequisites",
        "body_raw": "BodyguardAPG, Combat Reflexes, Vanguard Style, proficiency with light or heavy shields."
      },
      {
        "heading_raw": "Benefit",
        "body_raw": "While using Vanguard Style, when an adjacent ally is attacked or required to make a Reflex saving throw, you can expend a use of an attack of opportunity to use both Bodyguard and Vanguard Style to protect that ally. You can also lose your shield bonus to AC to grant your ally a shield bonus to AC of the same value for as long as that ally gains a bonus to Reflex saves from Vanguard Style."
      }
    ],
    "document_raw": {
      "node_type": "document",
      "content": [
        {
          "node_type": "paragraph",
          "content": [
            {
              "node_type": "text",
              "value": "Source",
              "marks": [
                "bold"
              ]
            },
            {
              "node_type": "text",
              "value": " "
            },
            {
              "node_type": "text",
              "value": "Armor Master's Handbook pg. 13",
              "marks": [
                "italic"
              ]
            },
            {
              "node_type": "hard_break"
            },
            {
              "node_type": "text",
              "value": "You strongly defend your allies."
            }
          ]
        },
        {
          "node_type": "paragraph",
          "content": [
            {
              "node_type": "text",
              "value": "Prerequisites",
              "marks": [
                "bold"
              ]
            },
            {
              "node_type": "text",
              "value": ": Bodyguard"
            },
            {
              "node_type": "text",
              "value": "APG",
              "marks": [
                "superscript"
              ]
            },
            {
              "node_type": "text",
              "value": ", Combat Reflexes, Vanguard Style, proficiency with light or heavy shields."
            }
          ]
        },
        {
          "node_type": "paragraph",
          "content": [
            {
              "node_type": "text",
              "value": "Benefit",
              "marks": [
                "bold"
              ]
            },
            {
              "node_type": "text",
              "value": ": While using Vanguard Style, when an adjacent ally is attacked or required to make a Reflex saving throw, you can expend a use of an attack of opportunity to use both Bodyguard and Vanguard Style to protect that ally. You can also lose your shield bonus to AC to grant your ally a shield bonus to AC of the same value for as long as that ally gains a bonus to Reflex saves from Vanguard Style."
            }
          ]
        }
      ]
    },
    "feat_types_raw": [
      "Combat",
      "Shield Style"
    ],
    "source_tags_raw": [],
    "prerequisites_raw": "BodyguardAPG, Combat Reflexes, Vanguard Style, proficiency with light or heavy shields.",
    "summary_raw": "You strongly defend your allies.",
    "publications_raw": [
      {
        "text_raw": "Armor Master's Handbook pg. 13",
        "href_raw": "http://paizo.com/products/btpy9jbh?Pathfinder-Player-Companion-Armor-Masters-Handbook\n",
        "href_resolved": "http://paizo.com/products/btpy9jbh?Pathfinder-Player-Companion-Armor-Masters-Handbook"
      }
    ],
    "pfs_marker_raw": {
      "image_src_raw": "images\\PathfinderSocietySymbol.gif",
      "title_raw": "PFS Legal"
    },
    "catalog_memberships_raw": [
      "aon-all-feats"
    ],
    "supplements_raw": [],
    "source_record_key_raw": "Vanguard Ward"
  },
  "warnings": []
}
