{
  "$schema": "../../../../schemas/source-entity-observation.schema.json",
  "schema_version": "0.1.0",
  "observation_id": "d20pfsrd:feat.secret-of-magical-discipline:4b2ebc4b3a703a60",
  "entity_type": "feat",
  "source": {
    "site_id": "d20pfsrd",
    "url": "https://www.d20pfsrd.com/feats/general-feats/secret-of-magical-discipline/",
    "license_url": null,
    "declared_publisher": null,
    "first_party_status": "unknown"
  },
  "retrieval": {
    "retrieved_at": "2026-09-12T20:18:21.976Z",
    "http_status": 200,
    "content_sha256": "4b2ebc4b240c7d46d4e409214f6161d6635357b659a0ee6cfb9bcc7101c8abce",
    "raw_artifact_path": "../../../raw/feats/source-candidates/bbc67861ccab94385cb9ab76889d146e52838edf48e15cef270510abd074650b.html",
    "response_content_type": "text/html"
  },
  "parser": {
    "name": "d20pfsrd-feat-comparison-adapter",
    "version": "0.1.2",
    "parsed_at": "2026-09-12T20:18:22.019Z"
  },
  "page": {
    "title_raw": "Secret of Magical Discipline – d20PFSRD",
    "breadcrumbs_raw": [],
    "license_notice_raw": null,
    "source_notice_raw": "Section 15: Copyright Notice Pathfinder Player Companion: Chronicle of Legends © 2019, Paizo Inc.; Authors: Calder CaDavid, Vanessa Hoskins, Mike Kimmel, Isabelle Lee, Matt Morris, Mikhail Rekun, and Michael Sayre."
  },
  "entity_raw": {
    "name_raw": "Secret of Magical Discipline",
    "definition_type_raw": null,
    "source_book_raw": "Pathfinder Player Companion: Chronicle of Legends",
    "definition_raw": "Your study and devotion to magic allows you to access spells beyond your ken.\n\nPrerequisite(s): Secret class feature.\n\nBenefit(s): Once per day, you can cast any spell as if it were one of your prepared spells or spells known. This action expends either a spell slot or a prepared spell of the same spell level. Casting a spell this way always has a minimum casting time of 1 full round.\n\nSpecial: You can gain this feat multiple times. Each time you take the feat, you can use this ability one additional time per day.",
    "links_raw": [
      {
        "anchor_text_raw": "casting time",
        "href_raw": "https://www.d20pfsrd.com/magic#TOC-Casting-Time",
        "href_resolved": "https://www.d20pfsrd.com/magic#TOC-Casting-Time",
        "source_field": "/entity_raw/sections_raw",
        "context_raw": "Benefit(s): Once per day, you can cast any spell as if it were one of your prepared spells or spells known. This action expends either a spell slot or a prepared spell of the same spell level. Casting a spell this way always has a minimum casting time of 1 full round.",
        "role_hint": "cross_reference",
        "target_entity_type_hint": "unknown",
        "target_entity_id_hint": null
      },
      {
        "anchor_text_raw": "Pathfinder Player Companion: Chronicle of Legends",
        "href_raw": "https://amzn.to/2Qd7Bem",
        "href_resolved": "https://amzn.to/2Qd7Bem",
        "source_field": "/entity_raw/publications_raw",
        "context_raw": "Section 15: Copyright Notice Pathfinder Player Companion: Chronicle of Legends © 2019, Paizo Inc.; Authors: Calder CaDavid, Vanessa Hoskins, Mike Kimmel, Isabelle Lee, Matt Morris, Mikhail Rekun, and Michael Sayre.",
        "role_hint": "publication",
        "target_entity_type_hint": "publication",
        "target_entity_id_hint": null
      }
    ],
    "sections_raw": [
      {
        "heading_raw": "Prerequisite(s)",
        "body_raw": "Secret class feature."
      },
      {
        "heading_raw": "Benefit(s)",
        "body_raw": "Once per day, you can cast any spell as if it were one of your prepared spells or spells known. This action expends either a spell slot or a prepared spell of the same spell level. Casting a spell this way always has a minimum casting time of 1 full round."
      },
      {
        "heading_raw": "Special",
        "body_raw": "You can gain this feat multiple times. Each time you take the feat, you can use this ability one additional time per day."
      }
    ],
    "document_raw": {
      "node_type": "document",
      "content": [
        {
          "node_type": "paragraph",
          "content": [
            {
              "node_type": "text",
              "value": "Your study and devotion to magic allows you to access spells beyond your ken."
            }
          ]
        },
        {
          "node_type": "paragraph",
          "content": [
            {
              "node_type": "text",
              "value": "Prerequisite(s)",
              "marks": [
                "bold"
              ]
            },
            {
              "node_type": "text",
              "value": ": Secret class feature."
            }
          ]
        },
        {
          "node_type": "paragraph",
          "content": [
            {
              "node_type": "text",
              "value": "Benefit(s)",
              "marks": [
                "bold"
              ]
            },
            {
              "node_type": "text",
              "value": ": Once per day, you can cast any spell as if it were one of your prepared spells or spells known. This action expends either a spell slot or a prepared spell of the same spell level. Casting a spell this way always has a minimum casting time of 1 full round."
            }
          ]
        },
        {
          "node_type": "paragraph",
          "content": [
            {
              "node_type": "text",
              "value": "Special",
              "marks": [
                "bold"
              ]
            },
            {
              "node_type": "text",
              "value": ": You can gain this feat multiple times. Each time you take the feat, you can use this ability one additional time per day."
            }
          ]
        }
      ]
    },
    "feat_types_raw": [],
    "source_tags_raw": [],
    "prerequisites_raw": "Secret class feature.",
    "summary_raw": "Your study and devotion to magic allows you to access spells beyond your ken.",
    "publications_raw": [
      {
        "text_raw": "Pathfinder Player Companion: Chronicle of Legends",
        "href_raw": "https://amzn.to/2Qd7Bem",
        "href_resolved": "https://amzn.to/2Qd7Bem"
      }
    ],
    "pfs_marker_raw": null,
    "catalog_memberships_raw": [
      "d20pfsrd-feat-catalog-comparison"
    ],
    "supplements_raw": [
      {
        "heading_raw": "Section 15: Copyright Notice",
        "kind_hint": "unknown"
      }
    ],
    "source_record_key_raw": "https://www.d20pfsrd.com/feats/general-feats/secret-of-magical-discipline/"
  },
  "warnings": [
    {
      "code": "COMPARISON_SECTIONS_MATCH",
      "severity": "info",
      "field": null,
      "message": "All parsed rule sections match AoN for feat.secret-of-magical-discipline; source-specific text and tags remain separate."
    },
    {
      "code": "SUPPLEMENT_EXCLUDED",
      "severity": "info",
      "field": "/entity_raw/supplements_raw",
      "message": "Section 15: Copyright Notice remains in the immutable source artifact and is excluded from the base feat observation."
    }
  ]
}
