{
  "$schema": "../../../../schemas/source-entity-observation.schema.json",
  "schema_version": "0.1.0",
  "observation_id": "aon:feat.unusual-heritage-fetchling:b3bcd7e9ca20095e",
  "entity_type": "feat",
  "source": {
    "site_id": "aon",
    "url": "https://www.aonprd.com/FeatDisplay.aspx?ItemName=Unusual+Heritage+%28Fetchling%29",
    "license_url": "https://www.aonprd.com/Licenses.aspx",
    "declared_publisher": "Paizo",
    "first_party_status": "confirmed"
  },
  "retrieval": {
    "retrieved_at": "2026-09-12T20:42:39.997Z",
    "http_status": 200,
    "content_sha256": "b3bcd7e9b962e7e6cc617492bf80dffd6088ae0f410fd4bcb4488085823ee795",
    "raw_artifact_path": "../../../raw/feats/batch/unusual-heritage-fetchling/aon.html",
    "response_content_type": "text/html; charset=utf-8"
  },
  "parser": {
    "name": "aon-feat-batch-adapter",
    "version": "0.1.0",
    "parsed_at": "2026-09-13T04:49:31.297Z"
  },
  "page": {
    "title_raw": "Unusual Heritage (Fetchling) - Feats - Archives of Nethys: Pathfinder RPG Database",
    "breadcrumbs_raw": [],
    "license_notice_raw": null,
    "source_notice_raw": "Bastards of Golarion pg. 17"
  },
  "entity_raw": {
    "name_raw": "Unusual Heritage (Fetchling)",
    "definition_type_raw": null,
    "source_book_raw": "Bastards of Golarion pg. 17",
    "definition_raw": "Source Bastards of Golarion pg. 17\nYour heritage is strange or difficult to trace, and people fear your otherworldly powers.\n\nPrerequisites: Fetchling.\n\nBenefit: You have the mysterious ability to see into the Shadow Plane, but only in your dreams. Once per day while sleeping, you can create a magical sensor, as arcane eye except this sensor can view only your current location as it exists on the Shadow Plane. This effect lasts for 1 minute per character level, and can be used during any point while you sleep.",
    "links_raw": [
      {
        "anchor_text_raw": "Bastards of Golarion pg. 17",
        "href_raw": "http://paizo.com/products/btpy93na?Pathfinder-Player-Companion-Bastards-of-Golarion",
        "href_resolved": "http://paizo.com/products/btpy93na?Pathfinder-Player-Companion-Bastards-of-Golarion",
        "source_field": "/entity_raw/publications_raw",
        "context_raw": "Bastards of Golarion pg. 17",
        "role_hint": "publication",
        "target_entity_type_hint": "publication",
        "target_entity_id_hint": null
      }
    ],
    "sections_raw": [
      {
        "heading_raw": "Prerequisites",
        "body_raw": "Fetchling."
      },
      {
        "heading_raw": "Benefit",
        "body_raw": "You have the mysterious ability to see into the Shadow Plane, but only in your dreams. Once per day while sleeping, you can create a magical sensor, as arcane eye except this sensor can view only your current location as it exists on the Shadow Plane. This effect lasts for 1 minute per character level, and can be used during any point while you sleep."
      }
    ],
    "document_raw": {
      "node_type": "document",
      "content": [
        {
          "node_type": "paragraph",
          "content": [
            {
              "node_type": "text",
              "value": "Source",
              "marks": [
                "bold"
              ]
            },
            {
              "node_type": "text",
              "value": " "
            },
            {
              "node_type": "text",
              "value": "Bastards of Golarion pg. 17",
              "marks": [
                "italic"
              ]
            },
            {
              "node_type": "hard_break"
            },
            {
              "node_type": "text",
              "value": "Your heritage is strange or difficult to trace, and people fear your otherworldly powers."
            }
          ]
        },
        {
          "node_type": "paragraph",
          "content": [
            {
              "node_type": "text",
              "value": "Prerequisites",
              "marks": [
                "bold"
              ]
            },
            {
              "node_type": "text",
              "value": ": Fetchling."
            }
          ]
        },
        {
          "node_type": "paragraph",
          "content": [
            {
              "node_type": "text",
              "value": "Benefit",
              "marks": [
                "bold"
              ]
            },
            {
              "node_type": "text",
              "value": ": You have the mysterious ability to see into the Shadow Plane, but only in your dreams. Once per day while sleeping, you can create a magical sensor, as "
            },
            {
              "node_type": "text",
              "value": "arcane eye ",
              "marks": [
                "italic"
              ]
            },
            {
              "node_type": "text",
              "value": "except this sensor can view only your current location as it exists on the Shadow Plane. This effect lasts for 1 minute per character level, and can be used during any point while you sleep."
            }
          ]
        }
      ]
    },
    "feat_types_raw": [],
    "source_tags_raw": [],
    "prerequisites_raw": "Fetchling.",
    "summary_raw": "Your heritage is strange or difficult to trace, and people fear your otherworldly powers.",
    "publications_raw": [
      {
        "text_raw": "Bastards of Golarion pg. 17",
        "href_raw": "http://paizo.com/products/btpy93na?Pathfinder-Player-Companion-Bastards-of-Golarion",
        "href_resolved": "http://paizo.com/products/btpy93na?Pathfinder-Player-Companion-Bastards-of-Golarion"
      }
    ],
    "pfs_marker_raw": {
      "image_src_raw": "images\\PathfinderSocietySymbol.gif",
      "title_raw": "PFS Legal"
    },
    "catalog_memberships_raw": [
      "aon-all-feats"
    ],
    "supplements_raw": [],
    "source_record_key_raw": "Unusual Heritage (Fetchling)"
  },
  "warnings": []
}
