{
  "$schema": "../../../../schemas/source-entity-observation.schema.json",
  "schema_version": "0.1.0",
  "observation_id": "aon:feat.acrobatic-steps:058e604afa19c685",
  "entity_type": "feat",
  "source": {
    "site_id": "aon",
    "url": "https://www.aonprd.com/FeatDisplay.aspx?ItemName=Acrobatic+Steps",
    "license_url": "https://www.aonprd.com/Licenses.aspx",
    "declared_publisher": "Paizo",
    "first_party_status": "confirmed"
  },
  "retrieval": {
    "retrieved_at": "2026-09-09T06:03:03.984Z",
    "http_status": 200,
    "content_sha256": "058e604afef7f6899166eba4f184cad7c9d4a9c218b0da89d38279baa83098cc",
    "raw_artifact_path": "../../../raw/feats/batch/acrobatic-steps/aon.html",
    "response_content_type": "text/html; charset=utf-8"
  },
  "parser": {
    "name": "aon-feat-batch-adapter",
    "version": "0.1.0",
    "parsed_at": "2026-09-09T06:03:06.196Z"
  },
  "page": {
    "title_raw": "Acrobatic Steps - Feats - Archives of Nethys: Pathfinder RPG Database",
    "breadcrumbs_raw": [],
    "license_notice_raw": null,
    "source_notice_raw": "PRPG Core Rulebook pg. 113"
  },
  "entity_raw": {
    "name_raw": "Acrobatic Steps",
    "definition_type_raw": null,
    "source_book_raw": "PRPG Core Rulebook pg. 113",
    "definition_raw": "Source PRPG Core Rulebook pg. 113\nYou can easily move over and through obstacles.\n\nPrerequisites: Dex 15, Nimble Moves.\n\nBenefit: Whenever you move, you may move through up to 15 feet of difficult terrain each round as if it were normal terrain. The effects of this feat stack with those provided by Nimble Moves (allowing you to move normally through a total of 20 feet of difficult terrain each round).",
    "links_raw": [
      {
        "anchor_text_raw": "PRPG Core Rulebook pg. 113",
        "href_raw": "http://paizo.com/pathfinderRPG/v5748btpy88yj",
        "href_resolved": "http://paizo.com/pathfinderRPG/v5748btpy88yj",
        "source_field": "/entity_raw/publications_raw",
        "context_raw": "PRPG Core Rulebook pg. 113",
        "role_hint": "publication",
        "target_entity_type_hint": "publication",
        "target_entity_id_hint": null
      },
      {
        "anchor_text_raw": "Nimble Moves.",
        "href_raw": "FeatDisplay.aspx?ItemName=Nimble Moves",
        "href_resolved": "https://www.aonprd.com/FeatDisplay.aspx?ItemName=Nimble%20Moves",
        "source_field": "/entity_raw/prerequisites_raw",
        "context_raw": "Dex 15, Nimble Moves.",
        "role_hint": "prerequisite",
        "target_entity_type_hint": "feat",
        "target_entity_id_hint": "feat.nimble-moves"
      }
    ],
    "sections_raw": [
      {
        "heading_raw": "Prerequisites",
        "body_raw": "Dex 15, Nimble Moves."
      },
      {
        "heading_raw": "Benefit",
        "body_raw": "Whenever you move, you may move through up to 15 feet of difficult terrain each round as if it were normal terrain. The effects of this feat stack with those provided by Nimble Moves (allowing you to move normally through a total of 20 feet of difficult terrain each round)."
      }
    ],
    "document_raw": {
      "node_type": "document",
      "content": [
        {
          "node_type": "paragraph",
          "content": [
            {
              "node_type": "text",
              "value": "Source",
              "marks": [
                "bold"
              ]
            },
            {
              "node_type": "text",
              "value": " "
            },
            {
              "node_type": "text",
              "value": "PRPG Core Rulebook pg. 113",
              "marks": [
                "italic"
              ]
            },
            {
              "node_type": "hard_break"
            },
            {
              "node_type": "text",
              "value": "You can easily move over and through obstacles."
            }
          ]
        },
        {
          "node_type": "paragraph",
          "content": [
            {
              "node_type": "text",
              "value": "Prerequisites",
              "marks": [
                "bold"
              ]
            },
            {
              "node_type": "text",
              "value": ": Dex 15, Nimble Moves."
            }
          ]
        },
        {
          "node_type": "paragraph",
          "content": [
            {
              "node_type": "text",
              "value": "Benefit",
              "marks": [
                "bold"
              ]
            },
            {
              "node_type": "text",
              "value": ": Whenever you move, you may move through up to 15 feet of difficult terrain each round as if it were normal terrain. The effects of this feat stack with those provided by Nimble Moves (allowing you to move normally through a total of 20 feet of difficult terrain each round)."
            }
          ]
        }
      ]
    },
    "feat_types_raw": [],
    "source_tags_raw": [],
    "prerequisites_raw": "Dex 15, Nimble Moves.",
    "summary_raw": "You can easily move over and through obstacles.",
    "publications_raw": [
      {
        "text_raw": "PRPG Core Rulebook pg. 113",
        "href_raw": "http://paizo.com/pathfinderRPG/v5748btpy88yj",
        "href_resolved": "http://paizo.com/pathfinderRPG/v5748btpy88yj"
      }
    ],
    "pfs_marker_raw": {
      "image_src_raw": "images\\PathfinderSocietySymbol.gif",
      "title_raw": "PFS Legal"
    },
    "catalog_memberships_raw": [
      "aon-all-feats"
    ],
    "supplements_raw": [],
    "source_record_key_raw": "Acrobatic Steps"
  },
  "warnings": []
}
