{
  "$schema": "../../../../schemas/source-entity-observation.schema.json",
  "schema_version": "0.1.0",
  "observation_id": "aon:feat.additional-traits:2515b0237953947f",
  "entity_type": "feat",
  "source": {
    "site_id": "aon",
    "url": "https://www.aonprd.com/FeatDisplay.aspx?ItemName=Additional+Traits",
    "license_url": "https://www.aonprd.com/Licenses.aspx",
    "declared_publisher": "Paizo",
    "first_party_status": "confirmed"
  },
  "retrieval": {
    "retrieved_at": "2026-09-09T06:14:50.428Z",
    "http_status": 200,
    "content_sha256": "2515b023ece1ce7b5543d64f0d1e34784256e16dfbc6aa83854513100b3ee895",
    "raw_artifact_path": "../../../raw/feats/batch/additional-traits/aon.html",
    "response_content_type": "text/html; charset=utf-8"
  },
  "parser": {
    "name": "aon-feat-batch-adapter",
    "version": "0.1.0",
    "parsed_at": "2026-09-09T06:14:56.829Z"
  },
  "page": {
    "title_raw": "Additional Traits - Feats - Archives of Nethys: Pathfinder RPG Database",
    "breadcrumbs_raw": [],
    "license_notice_raw": null,
    "source_notice_raw": "Advanced Player's Guide pg. 150; Second Darkness Player's Guide pg. 12; Pathfinder #16: Endless Night pg. 15"
  },
  "entity_raw": {
    "name_raw": "Additional Traits",
    "definition_type_raw": null,
    "source_book_raw": "Advanced Player's Guide pg. 150; Second Darkness Player's Guide pg. 12; Pathfinder #16: Endless Night pg. 15",
    "definition_raw": "Source Advanced Player's Guide pg. 150, Second Darkness Player's Guide pg. 12, Pathfinder #16: Endless Night pg. 15\nYou have more traits than normal.\n\nBenefit: You gain two character traits of your choice (see Chapter 8). These traits must be chosen from different lists, and cannot be chosen from lists from which you have already selected a character trait. You must meet any additional qualifications for the character traits you choose.",
    "links_raw": [
      {
        "anchor_text_raw": "Advanced Player's Guide pg. 150",
        "href_raw": "http://paizo.com/pathfinderRPG/v5748btpy8fo1",
        "href_resolved": "http://paizo.com/pathfinderRPG/v5748btpy8fo1",
        "source_field": "/entity_raw/publications_raw",
        "context_raw": "Advanced Player's Guide pg. 150",
        "role_hint": "publication",
        "target_entity_type_hint": "publication",
        "target_entity_id_hint": null
      },
      {
        "anchor_text_raw": "Second Darkness Player's Guide pg. 12",
        "href_raw": "http://paizo.com/store/downloads/pathfinder/pathfinderCompanion/35E/v5748btpy84en",
        "href_resolved": "http://paizo.com/store/downloads/pathfinder/pathfinderCompanion/35E/v5748btpy84en",
        "source_field": "/entity_raw/publications_raw",
        "context_raw": "Second Darkness Player's Guide pg. 12",
        "role_hint": "publication",
        "target_entity_type_hint": "publication",
        "target_entity_id_hint": null
      },
      {
        "anchor_text_raw": "Pathfinder #16: Endless Night pg. 15",
        "href_raw": "http://paizo.com/pathfinder/adventurePath/secondDarkness/v5748btpy85er",
        "href_resolved": "http://paizo.com/pathfinder/adventurePath/secondDarkness/v5748btpy85er",
        "source_field": "/entity_raw/publications_raw",
        "context_raw": "Pathfinder #16: Endless Night pg. 15",
        "role_hint": "publication",
        "target_entity_type_hint": "publication",
        "target_entity_id_hint": null
      }
    ],
    "sections_raw": [
      {
        "heading_raw": "Benefit",
        "body_raw": "You gain two character traits of your choice (see Chapter 8). These traits must be chosen from different lists, and cannot be chosen from lists from which you have already selected a character trait. You must meet any additional qualifications for the character traits you choose."
      }
    ],
    "document_raw": {
      "node_type": "document",
      "content": [
        {
          "node_type": "paragraph",
          "content": [
            {
              "node_type": "text",
              "value": "Source",
              "marks": [
                "bold"
              ]
            },
            {
              "node_type": "text",
              "value": " "
            },
            {
              "node_type": "text",
              "value": "Advanced Player's Guide pg. 150",
              "marks": [
                "italic"
              ]
            },
            {
              "node_type": "text",
              "value": ", "
            },
            {
              "node_type": "text",
              "value": "Second Darkness Player's Guide pg. 12",
              "marks": [
                "italic"
              ]
            },
            {
              "node_type": "text",
              "value": ", "
            },
            {
              "node_type": "text",
              "value": "Pathfinder #16: Endless Night pg. 15",
              "marks": [
                "italic"
              ]
            },
            {
              "node_type": "hard_break"
            },
            {
              "node_type": "text",
              "value": "You have more traits than normal."
            }
          ]
        },
        {
          "node_type": "paragraph",
          "content": [
            {
              "node_type": "text",
              "value": "Benefit",
              "marks": [
                "bold"
              ]
            },
            {
              "node_type": "text",
              "value": ": You gain two character traits of your choice (see Chapter 8). These traits must be chosen from different lists, and cannot be chosen from lists from which you have already selected a character trait. You must meet any additional qualifications for the character traits you choose."
            }
          ]
        }
      ]
    },
    "feat_types_raw": [],
    "source_tags_raw": [],
    "prerequisites_raw": null,
    "summary_raw": "You have more traits than normal.",
    "publications_raw": [
      {
        "text_raw": "Advanced Player's Guide pg. 150",
        "href_raw": "http://paizo.com/pathfinderRPG/v5748btpy8fo1",
        "href_resolved": "http://paizo.com/pathfinderRPG/v5748btpy8fo1"
      },
      {
        "text_raw": "Second Darkness Player's Guide pg. 12",
        "href_raw": "http://paizo.com/store/downloads/pathfinder/pathfinderCompanion/35E/v5748btpy84en",
        "href_resolved": "http://paizo.com/store/downloads/pathfinder/pathfinderCompanion/35E/v5748btpy84en"
      },
      {
        "text_raw": "Pathfinder #16: Endless Night pg. 15",
        "href_raw": "http://paizo.com/pathfinder/adventurePath/secondDarkness/v5748btpy85er",
        "href_resolved": "http://paizo.com/pathfinder/adventurePath/secondDarkness/v5748btpy85er"
      }
    ],
    "pfs_marker_raw": {
      "image_src_raw": "images\\PathfinderSocietySymbol.gif",
      "title_raw": "PFS Legal"
    },
    "catalog_memberships_raw": [
      "aon-all-feats"
    ],
    "supplements_raw": [],
    "source_record_key_raw": "Additional Traits"
  },
  "warnings": []
}
