{
  "$schema": "../../../../schemas/source-entity-observation.schema.json",
  "schema_version": "0.1.0",
  "observation_id": "aon:feat.improved-shield-focus:7614f35de2be115d",
  "entity_type": "feat",
  "source": {
    "site_id": "aon",
    "url": "https://www.aonprd.com/FeatDisplay.aspx?ItemName=Improved+Shield+Focus",
    "license_url": "https://www.aonprd.com/Licenses.aspx",
    "declared_publisher": "Paizo",
    "first_party_status": "confirmed"
  },
  "retrieval": {
    "retrieved_at": "2026-09-10T07:52:13.660Z",
    "http_status": 200,
    "content_sha256": "7614f35d5c549744a6e80d56c72beebc1d41fc4bd63ca43af5d0c621c11e842f",
    "raw_artifact_path": "../../../raw/feats/batch/improved-shield-focus/aon.html",
    "response_content_type": "text/html; charset=utf-8"
  },
  "parser": {
    "name": "aon-feat-batch-adapter",
    "version": "0.1.0",
    "parsed_at": "2026-09-10T07:53:45.725Z"
  },
  "page": {
    "title_raw": "Improved Shield Focus - Feats - Archives of Nethys: Pathfinder RPG Database",
    "breadcrumbs_raw": [],
    "license_notice_raw": null,
    "source_notice_raw": "Armor Master's Handbook pg. 18"
  },
  "entity_raw": {
    "name_raw": "Improved Shield Focus",
    "definition_type_raw": "Combat",
    "source_book_raw": "Armor Master's Handbook pg. 18",
    "definition_raw": "Source Armor Master's Handbook pg. 18\nYour mastery makes the most of your shield.\n\nPrerequisites: Shield Focus, base attack bonus +6.\n\nBenefit: You reduce the armor check penalty of any shield you are using by 1. You also use your character level in place of your base attack bonus for the purpose of shield mastery feat prerequisites.",
    "links_raw": [
      {
        "anchor_text_raw": "Armor Master's Handbook pg. 18",
        "href_raw": "http://paizo.com/products/btpy9jbh?Pathfinder-Player-Companion-Armor-Masters-Handbook\n",
        "href_resolved": "http://paizo.com/products/btpy9jbh?Pathfinder-Player-Companion-Armor-Masters-Handbook",
        "source_field": "/entity_raw/publications_raw",
        "context_raw": "Armor Master's Handbook pg. 18",
        "role_hint": "publication",
        "target_entity_type_hint": "publication",
        "target_entity_id_hint": null
      },
      {
        "anchor_text_raw": "Shield Focus",
        "href_raw": "FeatDisplay.aspx?ItemName=Shield Focus",
        "href_resolved": "https://www.aonprd.com/FeatDisplay.aspx?ItemName=Shield%20Focus",
        "source_field": "/entity_raw/prerequisites_raw",
        "context_raw": "Shield Focus, base attack bonus +6.",
        "role_hint": "prerequisite",
        "target_entity_type_hint": "feat",
        "target_entity_id_hint": "feat.shield-focus"
      }
    ],
    "sections_raw": [
      {
        "heading_raw": "Prerequisites",
        "body_raw": "Shield Focus, base attack bonus +6."
      },
      {
        "heading_raw": "Benefit",
        "body_raw": "You reduce the armor check penalty of any shield you are using by 1. You also use your character level in place of your base attack bonus for the purpose of shield mastery feat prerequisites."
      }
    ],
    "document_raw": {
      "node_type": "document",
      "content": [
        {
          "node_type": "paragraph",
          "content": [
            {
              "node_type": "text",
              "value": "Source",
              "marks": [
                "bold"
              ]
            },
            {
              "node_type": "text",
              "value": " "
            },
            {
              "node_type": "text",
              "value": "Armor Master's Handbook pg. 18",
              "marks": [
                "italic"
              ]
            },
            {
              "node_type": "hard_break"
            },
            {
              "node_type": "text",
              "value": "Your mastery makes the most of your shield."
            }
          ]
        },
        {
          "node_type": "paragraph",
          "content": [
            {
              "node_type": "text",
              "value": "Prerequisites",
              "marks": [
                "bold"
              ]
            },
            {
              "node_type": "text",
              "value": ": Shield Focus, base attack bonus +6."
            }
          ]
        },
        {
          "node_type": "paragraph",
          "content": [
            {
              "node_type": "text",
              "value": "Benefit",
              "marks": [
                "bold"
              ]
            },
            {
              "node_type": "text",
              "value": ": You reduce the armor check penalty of any shield you are using by 1. You also use your character level in place of your base attack bonus for the purpose of shield mastery feat prerequisites."
            }
          ]
        }
      ]
    },
    "feat_types_raw": [
      "Combat"
    ],
    "source_tags_raw": [],
    "prerequisites_raw": "Shield Focus, base attack bonus +6.",
    "summary_raw": "Your mastery makes the most of your shield.",
    "publications_raw": [
      {
        "text_raw": "Armor Master's Handbook pg. 18",
        "href_raw": "http://paizo.com/products/btpy9jbh?Pathfinder-Player-Companion-Armor-Masters-Handbook\n",
        "href_resolved": "http://paizo.com/products/btpy9jbh?Pathfinder-Player-Companion-Armor-Masters-Handbook"
      }
    ],
    "pfs_marker_raw": {
      "image_src_raw": "images\\PathfinderSocietySymbol.gif",
      "title_raw": "PFS Legal"
    },
    "catalog_memberships_raw": [
      "aon-all-feats"
    ],
    "supplements_raw": [
      {
        "heading_raw": "Combat Trick (from the Combat Stamina feat)",
        "kind_hint": "combat_trick"
      }
    ],
    "source_record_key_raw": "Improved Shield Focus"
  },
  "warnings": [
    {
      "code": "SUPPLEMENT_EXCLUDED",
      "severity": "info",
      "field": "/entity_raw/supplements_raw",
      "message": "Combat Trick (from the Combat Stamina feat) remains in the immutable source artifact and is excluded from the base feat observation."
    }
  ]
}
