{
  "$schema": "../../../../schemas/source-entity-observation.schema.json",
  "schema_version": "0.1.0",
  "observation_id": "d20pfsrd:feat.mental-stare:7b9cbd4d3a703a60",
  "entity_type": "feat",
  "source": {
    "site_id": "d20pfsrd",
    "url": "https://www.d20pfsrd.com/feats/general-feats/mental-stare-stare/",
    "license_url": null,
    "declared_publisher": null,
    "first_party_status": "unknown"
  },
  "retrieval": {
    "retrieved_at": "2026-09-12T19:32:30.720Z",
    "http_status": 200,
    "content_sha256": "7b9cbd4df61da2edc8eb156c683a73d5ab0a852b8126ea0d465a7c8e2ce64e03",
    "raw_artifact_path": "../../../raw/feats/source-candidates/c211f417ff35c14478e5728bad698b6e8bb160ae7b0318233a93b9e2ac0977d9.html",
    "response_content_type": "text/html"
  },
  "parser": {
    "name": "d20pfsrd-feat-comparison-adapter",
    "version": "0.1.2",
    "parsed_at": "2026-09-12T19:32:30.756Z"
  },
  "page": {
    "title_raw": "Mental Stare (Stare) – d20PFSRD",
    "breadcrumbs_raw": [],
    "license_notice_raw": null,
    "source_notice_raw": "Section 15: Copyright Notice Pathfinder Player Companion: Heroes of Golarion © 2019, Paizo Inc.; Authors: Saif Ansari, Alexander Augunas, Mara Lynn Butler, Michelle Jones, Avi Kool, and Alex Riggs."
  },
  "entity_raw": {
    "name_raw": "Mental Stare",
    "definition_type_raw": "Stare",
    "source_book_raw": "Pathfinder Player Companion: Heroes of Golarion",
    "definition_raw": "Blind mesmerists have learned to navigate the world without relying on sight and can use their hypnotic stare regardless of their sight level.\n\nPrerequisite(s): mesmerist, hypnotic stare class feature, blind.\n\nBenefit(s): You can use your hypnotic stare ability without relying on sight and do not have to attempt concentration checks to use this ability while blinded.",
    "links_raw": [
      {
        "anchor_text_raw": "mesmerist",
        "href_raw": "https://www.d20pfsrd.com/alternative-rule-systems/occult-adventures/occult-classes/mesmerist",
        "href_resolved": "https://www.d20pfsrd.com/alternative-rule-systems/occult-adventures/occult-classes/mesmerist",
        "source_field": "/entity_raw/prerequisites_raw",
        "context_raw": "Prerequisite(s): mesmerist, hypnotic stare class feature, blind.",
        "role_hint": "prerequisite",
        "target_entity_type_hint": "unknown",
        "target_entity_id_hint": null
      },
      {
        "anchor_text_raw": "blind",
        "href_raw": "https://www.d20pfsrd.com/gamemastering/conditions#TOC-Blinded",
        "href_resolved": "https://www.d20pfsrd.com/gamemastering/conditions#TOC-Blinded",
        "source_field": "/entity_raw/prerequisites_raw",
        "context_raw": "Prerequisite(s): mesmerist, hypnotic stare class feature, blind.",
        "role_hint": "prerequisite",
        "target_entity_type_hint": "unknown",
        "target_entity_id_hint": null
      },
      {
        "anchor_text_raw": "concentration",
        "href_raw": "https://www.d20pfsrd.com/magic#TOC-Concentration",
        "href_resolved": "https://www.d20pfsrd.com/magic#TOC-Concentration",
        "source_field": "/entity_raw/sections_raw",
        "context_raw": "Benefit(s): You can use your hypnotic stare ability without relying on sight and do not have to attempt concentration checks to use this ability while blinded.",
        "role_hint": "cross_reference",
        "target_entity_type_hint": "unknown",
        "target_entity_id_hint": null
      },
      {
        "anchor_text_raw": "blinded",
        "href_raw": "https://www.d20pfsrd.com/gamemastering/conditions#TOC-Blinded",
        "href_resolved": "https://www.d20pfsrd.com/gamemastering/conditions#TOC-Blinded",
        "source_field": "/entity_raw/sections_raw",
        "context_raw": "Benefit(s): You can use your hypnotic stare ability without relying on sight and do not have to attempt concentration checks to use this ability while blinded.",
        "role_hint": "cross_reference",
        "target_entity_type_hint": "unknown",
        "target_entity_id_hint": null
      },
      {
        "anchor_text_raw": "Pathfinder Player Companion: Heroes of Golarion",
        "href_raw": "https://amzn.to/2XWCEyw",
        "href_resolved": "https://amzn.to/2XWCEyw",
        "source_field": "/entity_raw/publications_raw",
        "context_raw": "Section 15: Copyright Notice Pathfinder Player Companion: Heroes of Golarion © 2019, Paizo Inc.; Authors: Saif Ansari, Alexander Augunas, Mara Lynn Butler, Michelle Jones, Avi Kool, and Alex Riggs.",
        "role_hint": "publication",
        "target_entity_type_hint": "publication",
        "target_entity_id_hint": null
      }
    ],
    "sections_raw": [
      {
        "heading_raw": "Prerequisite(s)",
        "body_raw": "mesmerist, hypnotic stare class feature, blind."
      },
      {
        "heading_raw": "Benefit(s)",
        "body_raw": "You can use your hypnotic stare ability without relying on sight and do not have to attempt concentration checks to use this ability while blinded."
      }
    ],
    "document_raw": {
      "node_type": "document",
      "content": [
        {
          "node_type": "paragraph",
          "content": [
            {
              "node_type": "text",
              "value": "Blind mesmerists have learned to navigate the world without relying on sight and can use their hypnotic stare regardless of their sight level."
            }
          ]
        },
        {
          "node_type": "paragraph",
          "content": [
            {
              "node_type": "text",
              "value": "Prerequisite(s)",
              "marks": [
                "bold"
              ]
            },
            {
              "node_type": "text",
              "value": ": mesmerist, hypnotic stare class feature, blind."
            }
          ]
        },
        {
          "node_type": "paragraph",
          "content": [
            {
              "node_type": "text",
              "value": "Benefit(s)",
              "marks": [
                "bold"
              ]
            },
            {
              "node_type": "text",
              "value": ": You can use your hypnotic stare ability without relying on sight and do not have to attempt concentration checks to use this ability while blinded."
            }
          ]
        }
      ]
    },
    "feat_types_raw": [
      "Stare"
    ],
    "source_tags_raw": [
      "Stare"
    ],
    "prerequisites_raw": "mesmerist, hypnotic stare class feature, blind.",
    "summary_raw": "Blind mesmerists have learned to navigate the world without relying on sight and can use their hypnotic stare regardless of their sight level.",
    "publications_raw": [
      {
        "text_raw": "Pathfinder Player Companion: Heroes of Golarion",
        "href_raw": "https://amzn.to/2XWCEyw",
        "href_resolved": "https://amzn.to/2XWCEyw"
      }
    ],
    "pfs_marker_raw": null,
    "catalog_memberships_raw": [
      "d20pfsrd-feat-catalog-comparison"
    ],
    "supplements_raw": [
      {
        "heading_raw": "Section 15: Copyright Notice",
        "kind_hint": "unknown"
      }
    ],
    "source_record_key_raw": "https://www.d20pfsrd.com/feats/general-feats/mental-stare-stare/"
  },
  "warnings": [
    {
      "code": "COMPARISON_PUBLICATION_MATCH",
      "severity": "info",
      "field": null,
      "message": "Unique feat name and publication match AoN for feat.mental-stare; rule differences remain source-attributed."
    },
    {
      "code": "SUPPLEMENT_EXCLUDED",
      "severity": "info",
      "field": "/entity_raw/supplements_raw",
      "message": "Section 15: Copyright Notice remains in the immutable source artifact and is excluded from the base feat observation."
    }
  ]
}
