{
  "$schema": "../../../../schemas/source-entity-observation.schema.json",
  "schema_version": "0.1.0",
  "observation_id": "aon:subdomain.thought:e162f0e8",
  "entity_type": "subdomain",
  "source": {
    "site_id": "aon",
    "url": "https://www.aonprd.com/DomainDisplay.aspx?ItemName=Knowledge",
    "license_url": "https://www.aonprd.com/Licenses.aspx",
    "declared_publisher": "Paizo",
    "first_party_status": "confirmed"
  },
  "retrieval": {
    "retrieved_at": "2026-08-22T07:04:18.725Z",
    "http_status": 200,
    "content_sha256": "e162f0e8e3be0fba2d555571fcab0c78d49db4e8953e8017bad5279707fb5da0",
    "raw_artifact_path": "../../../raw/entities/domain.knowledge/aon.html",
    "response_content_type": "text/html; charset=utf-8"
  },
  "parser": {
    "name": "aon-subdomain-spell-list-adapter",
    "version": "0.1.0",
    "parsed_at": "2026-08-22T07:04:18.725Z"
  },
  "page": {
    "title_raw": "Thought Subdomain",
    "breadcrumbs_raw": [
      "Classes",
      "Cleric",
      "Cleric/Inquisitor Subdomain",
      "Thought Subdomain"
    ],
    "license_notice_raw": null,
    "source_notice_raw": "Advanced Player's Guide pg. 1"
  },
  "entity_raw": {
    "name_raw": "Thought Subdomain",
    "definition_type_raw": "Cleric/Inquisitor Subdomain",
    "source_book_raw": "Advanced Player's Guide pg. 1",
    "definition_raw": "Thought SubdomainSource Advanced Player's Guide pg. 1Associated Domain(s): KnowledgeAssociated Deities: Abraxas, Amaznen, Bharnarol, Brigh, Erecura, Eritrice, Fandarra, Farfarello, Gruhastha, Hydim, Irori, Kelinahat, Kroina, Lissala, Lissala (pre-Earthfall), Maat, Magdh, Mephistopheles, Nethys, Ng, Norgorber, Nyarlathotep (Black Pharaoh), Nyarlathotep (Faceless Sphinx), Nyarlathotep (Haunter of the Dark), Pavnuri, Pharasma, Ptah, Rytara, Sivanah, Slandrais, Thuskchoon, Tsathoggua, Ulon, Vapula, Velgaas, Yog-Sothoth, ZohlsReplacement Power: The following granted power replaces the remote viewing power of the Knowledge domain. Read Minds (Su): At 8th level, you can broaden your mental spectrum to encompass those around you. Doing so allows you to read the mind of every creature within 30 feet as if you had cast detect thoughts. This ability allows you to read the surface thoughts of any creature that you are aware of after only 1 round of concentration. Creatures in this area are allowed a Will save to negate the effect. The DC of this Will save is 10 + 1/2 your cleric level + your Wisdom modifier. You can use this ability for a number of rounds per day equal to your cleric level. These rounds do not need to be consecutive.Replacement Domain Spells: 3rd—seek thoughts, 5th—telepathic bond, 8th—mind blank.",
    "links_raw": [],
    "sections_raw": [
      {
        "heading_raw": "Replacement Domain Spells",
        "body_raw": "3rd—seek thoughts, 5th—telepathic bond, 8th—mind blank"
      }
    ]
  },
  "warnings": []
}
